{
  "generated": "2026-08-17",
  "resources": [
    {
      "category": "tooling",
      "disposition": "ADOPT_AFTER_REVIEW",
      "evidence": [
        "https://github.com/rojo-rbx/rokit",
        "https://create.roblox.com/docs/projects/external-tools"
      ],
      "evidenceStatus": "verified",
      "id": "rokit",
      "integrationRole": "Pin the local Roblox toolchain without relying on machine-global Rojo, Wally, Selene, or StyLua binaries.",
      "license": "MIT",
      "licenseClass": "confirmed-permissive",
      "name": "Rokit",
      "nextAction": "Trial a project-local tool manifest on a disposable branch; do not install or update tools during asset ingest.",
      "notes": "Current project has no toolchain manifest. Rokit is the current candidate; Aftman/Foreman remain alternatives, not parallel dependencies.",
      "sourceUrl": "https://github.com/rojo-rbx/rokit"
    },
    {
      "category": "tooling",
      "disposition": "ADOPT_AFTER_REVIEW",
      "evidence": [
        "https://github.com/rojo-rbx/rojo",
        "https://create.roblox.com/docs/projects/external-tools"
      ],
      "evidenceStatus": "verified",
      "id": "rojo",
      "integrationRole": "Keep the filesystem/Git source tree synchronized with Roblox Studio through the existing default.project.json boundary.",
      "license": "MPL-2.0",
      "licenseClass": "confirmed-copyleft-tool",
      "name": "Rojo",
      "nextAction": "Pin a known compatible release and add a dry-run sync check after the asset registry is accepted.",
      "sourceUrl": "https://github.com/rojo-rbx/rojo"
    },
    {
      "category": "tooling",
      "disposition": "EVALUATE_SELECTIVELY",
      "evidence": [
        "https://github.com/UpliftGames/wally",
        "https://create.roblox.com/docs/projects/external-tools"
      ],
      "evidenceStatus": "verified",
      "id": "wally",
      "integrationRole": "Provide reproducible Luau package resolution only when a real shared runtime dependency is approved.",
      "license": "MPL-2.0",
      "licenseClass": "confirmed-copyleft-tool",
      "name": "Wally",
      "nextAction": "Do not add packages for the first terrain/asset slice; evaluate Wally with a lockfile when a dependency appears.",
      "sourceUrl": "https://github.com/UpliftGames/wally"
    },
    {
      "category": "tooling",
      "disposition": "ADOPT_AFTER_REVIEW",
      "evidence": [
        "https://github.com/Kampfkarren/selene"
      ],
      "evidenceStatus": "verified",
      "id": "selene",
      "integrationRole": "Lint Luau modules and catch accidental client/server boundary violations before Studio sync.",
      "license": "MPL-2.0",
      "licenseClass": "confirmed-copyleft-tool",
      "name": "Selene",
      "nextAction": "Add a minimal project config and CI lint job after the generated Luau contract settles.",
      "sourceUrl": "https://github.com/Kampfkarren/selene"
    },
    {
      "category": "tooling",
      "disposition": "ADOPT_AFTER_REVIEW",
      "evidence": [
        "https://github.com/JohnnyMorganz/StyLua"
      ],
      "evidenceStatus": "verified",
      "id": "stylua",
      "integrationRole": "Make generated and hand-written Luau formatting deterministic and reviewable.",
      "license": "MPL-2.0",
      "licenseClass": "confirmed-copyleft-tool",
      "name": "StyLua",
      "nextAction": "Pin a formatter release and run it in check-only mode before enabling write-mode hooks.",
      "sourceUrl": "https://github.com/JohnnyMorganz/StyLua"
    },
    {
      "category": "serialization",
      "disposition": "EVALUATE_SELECTIVELY",
      "evidence": [
        "https://github.com/rojo-rbx/rbx-dom"
      ],
      "evidenceStatus": "verified",
      "id": "rbx-dom",
      "integrationRole": "Future headless read/write and structural validation for Roblox model/place files outside Studio.",
      "license": "MIT",
      "licenseClass": "confirmed-permissive",
      "name": "rbx-dom",
      "nextAction": "Keep as a future export/validation adapter; do not replace Studio MCP or Rojo in the first slice.",
      "sourceUrl": "https://github.com/rojo-rbx/rbx-dom"
    },
    {
      "category": "asset-library",
      "disposition": "EVALUATE_SELECTIVELY",
      "evidence": [
        "https://quaternius.itch.io/150-lowpoly-nature-models"
      ],
      "evidenceStatus": "verified",
      "id": "quaternius-150-lowpoly-nature",
      "integrationRole": "Supplement the bundle's vegetation pools with low-poly tropical context candidates for distance/background use.",
      "license": "CC0",
      "licenseClass": "cc0-art-source",
      "name": "Quaternius 150+ Low Poly Nature Models",
      "nextAction": "Select only species and forms that match the UPLB art direction; download individual files, hash them, and record provenance.",
      "notes": "This is an additional candidate, not a license to bulk-download or ship the whole pack.",
      "sourceUrl": "https://quaternius.itch.io/150-lowpoly-nature-models"
    },
    {
      "category": "materials",
      "disposition": "EVALUATE_SELECTIVELY",
      "evidence": [
        "https://ambientcg.com/",
        "https://docs.ambientcg.com/license/"
      ],
      "evidenceStatus": "verified",
      "id": "ambientcg",
      "integrationRole": "Supply concrete, asphalt, paving, soil, grass, metal, and painted-surface PBR references/material inputs.",
      "license": "CC0 1.0 Universal",
      "licenseClass": "cc0-art-source",
      "name": "ambientCG",
      "nextAction": "Choose named assets from the official catalog, pin each asset URL and file hash, and resize/pack only what the Roblox budget permits.",
      "notes": "The site/API is not a runtime dependency; preserve the asset-level URL and CC0 notice in the canonical manifest.",
      "sourceUrl": "https://ambientcg.com/"
    },
    {
      "category": "gis-reference",
      "disposition": "REFERENCE_ONLY",
      "evidence": [
        "https://github.com/domlysz/BlenderGIS"
      ],
      "evidenceStatus": "verified",
      "id": "blendergis",
      "integrationRole": "Compare GIS/DEM/OSM import concepts while keeping the deterministic project Blender scripts as the source of truth.",
      "license": "GPL-3.0",
      "licenseClass": "confirmed-copyleft-tool",
      "name": "BlenderGIS",
      "nextAction": "Do not make BlenderGIS a project dependency; run a compatibility test only if an import gap is demonstrated.",
      "notes": "GPL and interactive-state coupling make this unsuitable for automatic vendoring in the current pipeline.",
      "sourceUrl": "https://github.com/domlysz/BlenderGIS"
    },
    {
      "category": "asset-library",
      "disposition": "EVALUATE_SELECTIVELY",
      "evidence": [
        "https://opengameart.org/content/low-poly-nature-group"
      ],
      "evidenceStatus": "verified-conditional",
      "id": "opengameart-low-poly-nature",
      "integrationRole": "Possible supplemental low-poly vegetation and rocks when a selected file's license and provenance are captured.",
      "license": "Per-file; page advertises CC0 for the group",
      "licenseClass": "verify-before-vendoring",
      "name": "OpenGameArt Low Poly Nature Group",
      "nextAction": "Review each file's own license/author notice before any download; reject files with ambiguous provenance.",
      "sourceUrl": "https://opengameart.org/content/low-poly-nature-group"
    },
    {
      "category": "community-signal",
      "disposition": "REFERENCE_ONLY",
      "evidence": [
        "https://github.com/Gzeu/roblox-procedural-worlds"
      ],
      "evidenceStatus": "unverified",
      "id": "roblox-procedural-worlds",
      "integrationRole": "Compare procedural-world configuration and export ideas without importing code or data into the canonical pipeline.",
      "license": "Not confirmed in this audit",
      "licenseClass": "reference-only-no-license",
      "name": "roblox-procedural-worlds",
      "nextAction": "Inspect repository license, commit activity, and data model only if a concrete worldgen gap remains.",
      "sourceUrl": "https://github.com/Gzeu/roblox-procedural-worlds"
    },
    {
      "category": "community-signal",
      "disposition": "REFERENCE_ONLY",
      "evidence": [
        "https://www.reddit.com/r/robloxgamedev/comments/1u0ch0k/any_tips_for_building/",
        "https://www.reddit.com/r/robloxgamedev/comments/1ksnmvo"
      ],
      "evidenceStatus": "research-only",
      "id": "reddit-roblox-building-signal",
      "integrationRole": "Non-authoritative corroboration for a greybox-first, Blender-for-meshes, Studio-for-behavior workflow.",
      "license": "Not an asset source",
      "licenseClass": "reference-only-no-license",
      "name": "Roblox building workflow community signal",
      "nextAction": "Use only as workflow context; never use Reddit comments to establish asset rights or factual UPLB dimensions.",
      "notes": "Community advice is useful for risk discovery, not a license or technical authority.",
      "sourceUrl": "https://www.reddit.com/r/robloxgamedev/comments/1u0ch0k/any_tips_for_building/"
    }
  ],
  "schemaVersion": 1,
  "sourceBundle": {
    "binaryAssetsIncluded": false,
    "path": "research/asset-ingest/uplb_asset_ingest",
    "registrySha256": "F6AF901249D235CCD2C1622DFAB8DD5AB6EF040E481B7D02C6976ECFD15E6321",
    "zipSha256": "6FC42C57EC4B5A6ECBE98A487E590BFE7245F89C0F81BC86DA453AAAEEEAF19A"
  }
}
